{
  "schemaVersion": "1.0",
  "units": "m",
  "origin": [0, 0],
  "levels": [
    {
      "id": "level_1",
      "elevation": 0,
      "entities": [
        { "id": "wall_north", "type": "wall", "path": [[0, 0], [6.4, 0]], "thickness": 0.18 },
        { "id": "wall_east", "type": "wall", "path": [[6.4, 0], [6.4, 4.8]], "thickness": 0.18 },
        { "id": "sofa_1", "type": "object", "catalogItemId": null, "position": [0.8, 0.7], "size": [2.1, 0.9], "rotation": 0 }
      ]
    }
  ],
  "constraints": [
    {
      "id": "passage_1",
      "type": "minimum_clearance",
      "entityIds": ["sofa_1", "wall_east"],
      "severity": "warning",
      "parameters": { "minimumMeters": 0.7 }
    }
  ],
  "metadata": { "sourceVersionId": null }
}
